id,title,assignee,inventor/author,priority date,filing/creation date,publication date,grant date,result link,representative figure link
US-9017659-B2,Pathotropic targeted gene delivery system for cancer and other disorders ,Epeius Biotechnologies Corporation,"Frederick L. Hall, Erlinda M. Gordon",11/3/2006,11/5/2007,4/28/2015,4/28/2015,https://patents.google.com/patent/US9017659B2/en,https://patentimages.storage.googleapis.com/02/a6/fa/71c5007d1fbc4e/US09017659-20150428-D00001.png
US-6552005-B1,Molecular chemotherapy enhancement of radiotherapy ,Uab Research Foundation,"Donald J. Buchsbaum, C. Ryan Miller, G. Yancey Gillespie, Robert J. Garver, Jr.",9/29/1998,11/3/2000,4/22/2003,4/22/2003,https://patents.google.com/patent/US6552005B1/en,https://patentimages.storage.googleapis.com/6b/ea/e1/fd9ea4d6da2238/US06552005-20030422-D00001.png
US-7326418-B2,Identification of novel factors that block programmed cell death or apoptosis by targeting JNK ,University Of Chicago,"Guido Franzoso, Salvatore Papa, Concetta Bubici, Francesca Zazzeroni",10/2/2001,11/29/2004,2/5/2008,2/5/2008,https://patents.google.com/patent/US7326418B2/en,https://patentimages.storage.googleapis.com/US7326418B2/US07326418-20080205-D00001.png
US-8080536-B2,Phosphorus-containing prodrugs ,"Metabasis Therapeutics, Inc.","Mark D. Erion, K. Raja Reddy, Serge H. Boyer",3/5/1999,9/24/2010,12/20/2011,12/20/2011,https://patents.google.com/patent/US8080536B2/en,
US-7691863-B2,Pyrazine-2-carboxamide derivatives as CB2 receptor modulators ,Hoffman-La Roche Inc.,"Michel Dietz, Sabine Gruener, Paul Hebeisen, Sylvie C. Meyer Reigner, Matthias Nettekoven, Bernd Puellmann, Stephan Roever, Christoph Ullmer",10/4/2006,9/24/2007,4/6/2010,4/6/2010,https://patents.google.com/patent/US7691863B2/en,
US-6984513-B2,Anaerobe targeted enzyme-mediated prodrug therapy ,The Board Of Trustees Of The Leland Stanford Junior University,"John M. Brown, Shie-Chau Liu, Amato J. Giaccia, Nigel P. Minton",3/3/1994,5/31/2002,1/10/2006,1/10/2006,https://patents.google.com/patent/US6984513B2/en,https://patentimages.storage.googleapis.com/1f/e8/e5/b01edbb8db6943/US06984513-20060110-D00001.png
US-7041654-B2,Methods and compositions for inducing tumor-specific cytotoxicity ,Yissum Research Development Company Of The Hebrew University Of Jerusalem,"Abraham Hochberg, Suhail Ayesh",10/3/1997,10/22/2001,5/9/2006,5/9/2006,https://patents.google.com/patent/US7041654B2/en,https://patentimages.storage.googleapis.com/US7041654B2/US07041654-20060509-D00001.png
US-9623098-B2,Combined measles-human papilloma vaccine ,Cadila Healthcare Limited,"Sanjeev K. Mendiretta, Reinhard Glueck, Viviana Giannino, Giuseppina Cantarella, Francesca Scuderi, Martin Billeter, Agata Fazzio",5/26/2008,5/26/2009,4/18/2017,4/18/2017,https://patents.google.com/patent/US9623098B2/en,https://patentimages.storage.googleapis.com/b7/ab/af/3f0f1e008c3f2f/US09623098-20170418-D00001.png
US-9814714-B2,"Kinase modulation, and indications therefor ",Plexxikon Inc.,"Prabha N. Ibrahim, Chao Zhang, Wayne Spevak, Jiazhong Zhang, Guoxian Wu, Jack Lin, Hanna Cho, Marika Nespi, Songyuan Shi, Todd Ewing, Ying Zhang, Gideon Bollag",5/22/2015,5/20/2016,11/14/2017,11/14/2017,https://patents.google.com/patent/US9814714B2/en,https://patentimages.storage.googleapis.com/d8/7d/7e/42ce7c214b1f4e/US09814714-20171114-D00001.png
US-9803219-B2,Adenovirus derived helper virus for enhancing recombinant parvovirus production ,Deutsches Krebsforschungszentrum,"Nazim El-Andaloussi, Antonio Marchini, Jean Rommelaere, Barbara Leuchs, Max ENDELE",3/26/2010,9/26/2012,10/31/2017,10/31/2017,https://patents.google.com/patent/US9803219B2/en,https://patentimages.storage.googleapis.com/59/8f/ed/f536ef8a980f76/US09803219-20171031-D00001.png
US-8557290-B2,Multifunction nanoconjugates for imaging applications and targeted treatment ,Northwestern University,"Ai-Guo Wu, Tatjana Paunesku, Gayle E. Woloschak",3/14/2008,3/13/2009,10/15/2013,10/15/2013,https://patents.google.com/patent/US8557290B2/en,https://patentimages.storage.googleapis.com/d9/02/3c/1d9423b44ee61c/US08557290-20131015-D00001.png
US-9987311-B2,Compositions comprising bacterial strains ,4D Pharma Research Limited,"Imke Elisabeth MULDER, Amy Beth HOLT, Seanin Marie MCCLUSKEY, Grainne Clare LENNON, Suaad AHMED",11/23/2015,11/23/2016,6/5/2018,6/5/2018,https://patents.google.com/patent/US9987311B2/en,https://patentimages.storage.googleapis.com/75/86/d9/e12cdb01dfd0cf/US09987311-20180605-D00001.png
US-5378718-A,"1,4-dihydropyridine derivatives ",Cedona Pharmaceuticals B.V.,"Jan Bron, Geert J. Sterk, Hendrik Timmerman, Jan F. van der Werf",8/2/1990,7/31/1991,1/3/1995,1/3/1995,https://patents.google.com/patent/US5378718A/en,https://patentimages.storage.googleapis.com/3c/46/a5/6840f78b9c0b2b/US5378718-drawings-page-2.png
US-8052966-B2,Methods and compositions for treating metastatic cancer ,University Of Southern California,"Frederick L. Hall, Erlinda M. Gordon",4/21/2003,4/21/2004,11/8/2011,11/8/2011,https://patents.google.com/patent/US8052966B2/en,https://patentimages.storage.googleapis.com/d0/6f/b5/9a913b524b0d01/US08052966-20111108-D00001.png
US-7163678-B2,Reovirus for the treatment of ral-mediated cellular proliferative disorders ,Oncolytics Biotech Inc.,"Kara L. Norman, Patrick W. K. Lee",11/7/2002,11/6/2003,1/16/2007,1/16/2007,https://patents.google.com/patent/US7163678B2/en,
US-10111947-B2,Virus-containing formulation and use thereof ,Transgene S.A.,"Claude Sene, Mélina Chasle",10/2/2012,10/2/2013,10/30/2018,10/30/2018,https://patents.google.com/patent/US10111947B2/en,https://patentimages.storage.googleapis.com/90/c6/1b/a5585ea519b96d/US10111947-20181030-D00000.png
US-9234183-B2,Retargeting of rat parvovirus H-1PV to cancer cells through genetic engineering of its capsid ,Deutsches Krebsforschungzentrum,"Antonio Marchini, Nazim El-Andaloussi, Jean Rommelaere, Barbara Leuchs, Xavier ALLAUME",10/21/2010,4/9/2013,1/12/2016,1/12/2016,https://patents.google.com/patent/US9234183B2/en,https://patentimages.storage.googleapis.com/82/6e/85/7b496e24bc37e3/US09234183-20160112-D00001.png
US-9175309-B2,Recombinant adenovirus with enhanced therapeutic effect and pharmaceutical composition comprising said recombinant adenovirus ,Industry-University Cooperation Foundation Hanyang University,"Chae-Ok Yun, Joo-Hang Kim",9/29/2001,9/28/2002,11/3/2015,11/3/2015,https://patents.google.com/patent/US9175309B2/en,https://patentimages.storage.googleapis.com/78/59/6c/53f6e224b903ba/US09175309-20151103-D00001.png
US-10260049-B2,Attenuated reovirus ,"Virocure, Inc.","Manbok Kim, Randal N. Johnston",8/1/2005,7/31/2006,4/16/2019,4/16/2019,https://patents.google.com/patent/US10260049B2/en,https://patentimages.storage.googleapis.com/97/de/51/db3ddc9a4802cb/US10260049-20190416-D00001.png
US-9057057-B2,Obligate heterodimer variants of foki cleavage domain ,"The Johns Hopkins University, Pondicherry Biotech Private Limited (Pbpl)","Srinivasan Chandrasegaran, Sivaprakash Ramalingam, Karthikeyan Kandavelou",7/27/2010,7/27/2011,6/16/2015,6/16/2015,https://patents.google.com/patent/US9057057B2/en,https://patentimages.storage.googleapis.com/d4/ac/3f/f184d6cab55174/US09057057-20150616-D00001.png
US-8298790-B2,Methods for effectively coexpressing IL-12 and IL-23 ,Chae-Ok Yun,Chae-Ok Yun,5/14/2007,1/17/2008,10/30/2012,10/30/2012,https://patents.google.com/patent/US8298790B2/en,https://patentimages.storage.googleapis.com/cc/a6/c7/0db3f23e3952b4/US08298790-20121030-D00001.png
US-6518033-B1,Method of detecting the presence of CD155 for diagnosis of cancer and to determine treatment ,The Research Foundation Of State University Of New York,"Matthias Gromeier, Eckard Wimmer",8/5/1998,9/6/2000,2/11/2003,2/11/2003,https://patents.google.com/patent/US6518033B1/en,https://patentimages.storage.googleapis.com/US6518033B1/US06518033-20030211-D00001.png
US-10076547-B2,Gene-modified coxsackievirus ,"Shin Nihon Seiyaku Co., Ltd, Kyushu University National University Corporation","Kenzaburo Tani, Shohei Miyamoto, Hiroyuki Inoue, Miyako Sagara",4/17/2013,4/17/2014,9/18/2018,9/18/2018,https://patents.google.com/patent/US10076547B2/en,https://patentimages.storage.googleapis.com/04/4a/9f/b40dc29e11dd81/US10076547-20180918-D00001.png
US-8394365-B2,Multi-arm polymer prodrugs ,Nektar Therapeutics,"Xuan Zhao, Michael David Bentley, Zhongxu Ren, Tacey X. Viegas",9/17/2003,11/30/2007,3/12/2013,3/12/2013,https://patents.google.com/patent/US8394365B2/en,https://patentimages.storage.googleapis.com/bd/5f/f3/d4cec1686aa612/US08394365-20130312-D00000.png
US-9442114-B2,"Isolated and purified strains of Chikungunya virus and polynucleotides and polypeptides sequences, diagnostic and immunogenical uses thereof ",Institut Pasteur,"Philippe Despres, Anne-Claire Brehin, Valerie Marechal, Pierre Charneau, Philippe Souque",3/15/2006,7/18/2014,9/13/2016,9/13/2016,https://patents.google.com/patent/US9442114B2/en,https://patentimages.storage.googleapis.com/ba/c6/98/b4282d0ae946b6/US09442114-20160913-D00001.png
US-7354898-B2,Identification of novel factors that block programmed cell death or apoptosis by targeting JNK ,University Of Chicago,"Guido Franzoso, Salvatore Papa, Concetta Bubici, Francesca Zazzeroni",10/2/2001,1/10/2005,4/8/2008,4/8/2008,https://patents.google.com/patent/US7354898B2/en,https://patentimages.storage.googleapis.com/d9/3a/8a/c010bdf8484557/US07354898-20080408-D00033.png
US-8298801-B2,Methods and compositions for the treatment of cancer ,"Quintessence Biosciences, Inc.","John A. Kink, Laura E. Strong, Mark N. Shahan",7/17/2006,7/17/2007,10/30/2012,10/30/2012,https://patents.google.com/patent/US8298801B2/en,https://patentimages.storage.googleapis.com/82/9f/44/542d35967a85f9/US08298801-20121030-D00000.png
US-4853213-A,Use of periwinkle in oral hygiene ,"Peri-Oral Dental Products, Inc.",Neville Thame,3/17/1986,3/16/1988,8/1/1989,8/1/1989,https://patents.google.com/patent/US4853213A/en,
US-10253331-B2,Furin-knockdown and GM-CSF-augmented (FANG) cancer vaccine ,"Gradalis, Inc.","John J. Nemunaitis, Neil Senzer, Phillip B. Maples, Donald Rao",12/23/2009,8/29/2017,4/9/2019,4/9/2019,https://patents.google.com/patent/US10253331B2/en,https://patentimages.storage.googleapis.com/f7/88/6f/5d1955ac6e4b33/US10253331-20190409-D00001.png
US-10039827-B2,Reoviruses having modified sequences ,Oncolytics Biotech Inc.,Matthew C. Coffey,3/12/2007,2/13/2014,8/7/2018,8/7/2018,https://patents.google.com/patent/US10039827B2/en,https://patentimages.storage.googleapis.com/61/68/9e/46adf127d327ce/US10039827-20180807-D00001.png
US-8530636-B2,Method for regulating protein function in cells in vivo using synthetic small molecules ,The Board Of Trustees Of The Leland Stanford Junior University,"Thomas J. Wandless, Laura A. Banaszynski, Mark A. Sellmyer, Christopher H. Contag, Steven H. Thorne",5/7/2008,5/7/2009,9/10/2013,9/10/2013,https://patents.google.com/patent/US8530636B2/en,https://patentimages.storage.googleapis.com/28/4a/dd/7b61b9ddd429fc/US08530636-20130910-D00001.png
US-10046015-B2,Compositions comprising bacterial strains ,4D Pharma Research Limited,"Imke Elisabeth MULDER, Amy Beth HOLT, Seanin Marie MCCLUSKEY, Grainne Clare LENNON, Suaad AHMED",11/20/2015,11/21/2016,8/14/2018,8/14/2018,https://patents.google.com/patent/US10046015B2/en,https://patentimages.storage.googleapis.com/f1/0b/4b/d3c4bc3ddffe6e/US10046015-20180814-D00001.png
US-7314868-B2,Compositions and methods for elimination of unwanted cells ,Mayo Foundation For Medical Education And Research,"Stephen James Russell, Frances Joanne Morling, Adele Kay Fielding, Francois-Loic Cosset, Roberto Cattaneo",3/11/1997,12/10/2003,1/1/2008,1/1/2008,https://patents.google.com/patent/US7314868B2/en,https://patentimages.storage.googleapis.com/d6/7c/31/df287670862338/US07314868-20080101-D00003.png
US-8101740-B2,Positron emission tomography probes for imaging immune activation and selected cancers ,The Regents Of The University Of California,"Caius G. Radu, Owen N. Witte, Evan David Nair-Gill, Nagichettiar Satyamurthy, Chengyi J. Shu, Johannes Czernin",9/19/2007,9/19/2008,1/24/2012,1/24/2012,https://patents.google.com/patent/US8101740B2/en,https://patentimages.storage.googleapis.com/27/9f/d1/ed67e3919993dc/US08101740-20120124-D00001.png
US-7566548-B2,Methods for identifying therapeutic agents and for treating disease ,University Of Massachusetts,"Michael Green, Destin Heilman, Jose G. Teodoro",8/13/2004,8/15/2005,7/28/2009,7/28/2009,https://patents.google.com/patent/US7566548B2/en,https://patentimages.storage.googleapis.com/US7566548B2/US07566548-20090728-D00001.png
US-7211570-B2,Treatment of EBV and KHSV infection ,"Pharmasset, Inc., Emory University, Beth Israel Deaconess Medical Center","Raymond F. Schinazi, Junxing Shi, Joyce D. Fingeroth, Erik Gustafson",12/20/2001,12/19/2002,5/1/2007,5/1/2007,https://patents.google.com/patent/US7211570B2/en,
US-8460920-B2,Method for the purification of adenovirus particles ,Crucell Holland B.V.,"Marcel Leo de Vocht, Marloes Veenstra",10/15/2009,10/14/2010,6/11/2013,6/11/2013,https://patents.google.com/patent/US8460920B2/en,https://patentimages.storage.googleapis.com/b1/88/45/5dc7a05fd03e43/US08460920-20130611-D00001.png
US-10086037-B2,Compositions and methods to prevent cancer with cupredoxins ,"Tapas Das Gupta, Ananda Chakrabarty, Craig Beattie, Tohru Yamada","Tapas Das Gupta, Ananda Chakrabarty, Craig Beattie, Tohru Yamada",2/8/2007,7/30/2012,10/2/2018,10/2/2018,https://patents.google.com/patent/US10086037B2/en,https://patentimages.storage.googleapis.com/94/9e/4b/11e59f30658212/US10086037-20181002-D00001.png
US-8435752-B2,Gene polymorphisms predictive for dual TKI therapy ,University Of Southern California,Heinz-Josef Lenz,1/18/2007,1/17/2008,5/7/2013,5/7/2013,https://patents.google.com/patent/US8435752B2/en,
US-6566072-B1,"Mammaglobin, a secreted mammary-specific breast cancer protein ",Washington University,"Mark A. Watson, Timothy P. Fleming",5/31/1995,9/29/1998,5/20/2003,5/20/2003,https://patents.google.com/patent/US6566072B1/en,https://patentimages.storage.googleapis.com/e1/1a/7d/c078efaa7c67b0/US6566072-drawings-page-3.png
US-10322151-B2,Compositions comprising bacterial strains ,4D Pharma Research Limited,"George Grant, Angela Margaret PATTERSON, Imke Mulder, Seanin MCCLUSKEY, Emma RAFTIS",6/15/2015,8/9/2017,6/18/2019,6/18/2019,https://patents.google.com/patent/US10322151B2/en,https://patentimages.storage.googleapis.com/67/fa/7a/56c6bbdcaf9845/US10322151-20190618-D00001.png
US-9394303-B2,Small molecule inhibitors of MCL-1 and uses thereof ,The Regents Of The University Of Michigan,"Zaneta Nikolovska-Coleska, Fardokht Abulwerdi, Hollis Showalter, Lei Miao, Jeanne Stuckey, Ahmed Mady",4/4/2014,4/3/2015,7/19/2016,7/19/2016,https://patents.google.com/patent/US9394303B2/en,https://patentimages.storage.googleapis.com/47/9b/00/9a3702f8c5209e/US09394303-20160719-D00001.png
US-8993576-B2,"6-(1H-indol-4-yl)-4-(5-{[4-1-methylethyl)-1-piperazinyl]methyl}-1,3-oxazol-2-yl)-1H-indazole hemi succinate salt, polymorphs and pharmaceutical compositions thereof ",Glaxo Group Limited,"Julie Nicole Hamblin, Paul Spencer Jones, Suzanne Elaine Keeling, Joelle Le, Nigel James Parr, Robert David Willacy",10/27/2010,10/25/2011,3/31/2015,3/31/2015,https://patents.google.com/patent/US8993576B2/en,https://patentimages.storage.googleapis.com/ef/d2/d9/8facf3ec259926/US08993576-20150331-D00001.png
US-7998488-B2,Vaccine formulations and uses thereof ,"Baxter International Inc., Baxter Healthcare S.A.","Manfred Oberreither, Christa Tauer, Falko-Guenter Falkner",11/14/2008,11/14/2008,8/16/2011,8/16/2011,https://patents.google.com/patent/US7998488B2/en,https://patentimages.storage.googleapis.com/0a/bf/10/c77b2fab01053a/US07998488-20110816-D00001.png
US-10137182-B2,Cancer vaccines and vaccination methods ,"Immunocellular Therapeutics, Ltd.","James G. Bender, John S. Yu",2/14/2013,2/14/2014,11/27/2018,11/27/2018,https://patents.google.com/patent/US10137182B2/en,https://patentimages.storage.googleapis.com/f4/48/a8/c6d96301ed6d2b/US10137182-20181127-D00001.png
US-6699468-B1,Replication-competent herpes simplex virus mediates destruction of neoplastic cells ,Georgetown University,"Robert L. Martuza, Samuel D. Rabkin, Toshihiro Mineta",6/23/1994,7/25/2000,3/2/2004,3/2/2004,https://patents.google.com/patent/US6699468B1/en,https://patentimages.storage.googleapis.com/3b/71/12/5efa48831f323a/US06699468-20040302-D00001.png
US-8609685-B2,SMAC mimetic compounds as apoptosis inducers ,Cisi Scrl,"Carlo Scolastico, Leonardo Pierpaolo Manzoni, Pierfausto Seneci, Laura Belvisi, Domenico Delia, Martino Bolognesi, Eloise Mastrangelo, Mario De Mayo De Mari Milani, Ilaria Motto, Carmelo Drago",11/9/2007,11/5/2008,12/17/2013,12/17/2013,https://patents.google.com/patent/US8609685B2/en,
US-3418311-A,Polysaccharide and the preparation thereof ,Kaken Kagaku Kk,"Sakai Sumio, Sugayama Junichi, Saito Gosaku, Kamasuka Teruo, Kawaguchi-Shi Shoichi Takada, Takano Tosio",4/23/1963,1/25/1966,12/24/1968,12/24/1968,https://patents.google.com/patent/US3418311A/en,https://patentimages.storage.googleapis.com/3d/d2/e4/06a4a52782d3aa/US3418311-drawings-page-1.png
US-6509020-B1,Replication-competent herpes simplex virus ,The University Of Cincinnati,"Richard Brent Pyles, Linda Marie Parysek, Ronald E. Warnick",3/27/1997,3/27/1998,1/21/2003,1/21/2003,https://patents.google.com/patent/US6509020B1/en,https://patentimages.storage.googleapis.com/cf/8e/68/29532929280533/US6509020-drawings-page-2.png
US-9880171-B2,iASPP phosphorylation and metastatic potential ,Ludwig Institute For Cancer Research Ltd.,"Xin Lu, Min Lu",3/2/2012,3/1/2013,1/30/2018,1/30/2018,https://patents.google.com/patent/US9880171B2/en,https://patentimages.storage.googleapis.com/b3/e1/ed/0414f4c15b1e14/US09880171-20180130-D00001.png
US-7691827-B2,"Amide prodrug of gemcitabine, compositions and use thereof ",Eli Lilly And Company,"David Michael Bender, David Michael Remick",12/17/2004,11/30/2005,4/6/2010,4/6/2010,https://patents.google.com/patent/US7691827B2/en,
US-8568977-B2,Compositions and methods for diagnosis and treatment of tumors ,The United States Of America As Represented By The Secretary Of The Department Of Health And Human Services,"Vivian Takafuji, Xin Wei Wang, Paul K. Goldsmith",6/20/2006,7/16/2012,10/29/2013,10/29/2013,https://patents.google.com/patent/US8568977B2/en,https://patentimages.storage.googleapis.com/3d/3a/fe/96bc03cf90fcd8/US08568977-20131029-D00001.png
US-9598470-B2,Compositions and methods to prevent cancer by stabilizing P53 through non MDM2-mediated pathways ,"Craig W. Beattie, Tohru Yamada, Tapas K. Das Gupta","Craig W. Beattie, Tohru Yamada, Tapas K. Das Gupta",10/7/2004,5/18/2009,3/21/2017,3/21/2017,https://patents.google.com/patent/US9598470B2/en,https://patentimages.storage.googleapis.com/30/19/91/96f0ece05606de/US09598470-20170321-D00000.png
US-9486422-B2,Small molecule inhibitors of Mcl-1 and the uses of thereof ,"The Regents Of The University Of Michigan, Wayne State University","Zaneta Nikolovska-Coleska, Hollis D. Showalter, Chenzhong Liao, Ramzi Mohammad, Fardokht Abulwerdi",10/6/2011,10/8/2012,11/8/2016,11/8/2016,https://patents.google.com/patent/US9486422B2/en,https://patentimages.storage.googleapis.com/ed/06/6e/29072840e93752/US09486422-20161108-D00001.png
US-7364727-B2,Metastatic colon cancer specific promoter and uses thereof ,"Cell Genesys, Inc.","Yuanhao Li, De-Chao Yu",7/22/2002,7/21/2003,4/29/2008,4/29/2008,https://patents.google.com/patent/US7364727B2/en,https://patentimages.storage.googleapis.com/US7364727B2/US07364727-20080429-D00001.png
US-10308721-B2,Anti-DLL3 antibodies and drug conjugates for use in melanoma ,Abbvie Stemcentrx Llc,"Samuel Williams, Laura Saunders, Kathryn A LOVING",2/21/2014,2/23/2015,6/4/2019,6/4/2019,https://patents.google.com/patent/US10308721B2/en,https://patentimages.storage.googleapis.com/79/99/0f/04e206d7870d81/US10308721-20190604-D00001.png
US-6139834-A,Replication-competent Herpes simplex virus mediates destruction of neplastic cells ,Georgetown University,"Robert L. Martuza, Samuel D. Rabkin, Toshihiro Mineta",6/23/1994,1/8/1998,10/31/2000,10/31/2000,https://patents.google.com/patent/US6139834A/en,https://patentimages.storage.googleapis.com/bf/fb/97/cf3b2d09ea736f/US6139834-drawings-page-2.png
US-4252954-A,"Salts of dihalo-3,4-dihydro-3-oxo-2-quinoxaline carboxylic acids and hindered amines ",Eli Lilly And Company,"Riaz F. Abdulla, Donald C. DeLong",10/25/1979,10/25/1979,2/24/1981,2/24/1981,https://patents.google.com/patent/US4252954A/en,https://patentimages.storage.googleapis.com/3c/5d/7f/27fcc08d7c46c4/US4252954-drawings-page-2.png
US-9579365-B2,Therapeutic ribonucleases ,"Quintessence Biosciences, Inc.","Tony Klink, John Kink, Laura Strong",10/1/2008,4/14/2015,2/28/2017,2/28/2017,https://patents.google.com/patent/US9579365B2/en,
US-10266810-B2,Method for large scale production and purification of parvovirus ,Deutsches Krebsforschungszentrum,"Barbara Leuchs, Mandy Roscher, Marcus Müller, Jean Rommelaere",6/23/2015,6/22/2016,4/23/2019,4/23/2019,https://patents.google.com/patent/US10266810B2/en,https://patentimages.storage.googleapis.com/1c/2f/10/53ba629d12fb55/US10266810-20190423-D00000.png
US-9657069-B2,Anti-cancer compositions containing WNT decoy receptor ,"Genemedicine Co., Ltd.","Chae Ok Yun, Jung-sun Lee",8/18/2011,8/16/2012,5/23/2017,5/23/2017,https://patents.google.com/patent/US9657069B2/en,https://patentimages.storage.googleapis.com/88/6b/84/49539cb0aece13/US09657069-20170523-D00001.png
US-9533976-B2,γ-diketones as WNT/β-catenin signaling pathway activators ,"Samumed, Llc","Sunil Kumar KC, David Mark Wallace, John Hood, Charlene F. Barroga",2/22/2013,2/21/2014,1/3/2017,1/3/2017,https://patents.google.com/patent/US9533976B2/en,
US-8491886-B2,Viruses for the treatment of cellular proliferative disorders ,Oncolytics Biotech Inc.,"Matthew C. Coffey, Bradley G. Thompson",11/12/1999,11/16/2011,7/23/2013,7/23/2013,https://patents.google.com/patent/US8491886B2/en,https://patentimages.storage.googleapis.com/59/e2/0f/aee30ad79d9e7e/US08491886-20130723-D00001.png
US-9884053-B2,β- and γ-diketones and γ-hydroxyketones as WNT/β-catenin signaling pathway activators ,"Samumed, Llc","Sunil Kumar KC, David Mark Wallace, John Hood, Charlene F. Barroga",8/18/2010,11/11/2016,2/6/2018,2/6/2018,https://patents.google.com/patent/US9884053B2/en,
US-10244406-B2,Wireless sensor information monitoring ,Lonza Ltd.,"Rex Polley, Michael Goetter",3/7/2017,3/7/2017,3/26/2019,3/26/2019,https://patents.google.com/patent/US10244406B2/en,https://patentimages.storage.googleapis.com/8a/c3/32/8a78e79e723d30/US10244406-20190326-D00000.png
US-8945531-B2,Recombinant herpes virus and pharmaceutical composition containing the same ,The University Of Tokyo,"Tomoki Todo, Hiroshi Fukuhara",2/19/2010,2/19/2010,2/3/2015,2/3/2015,https://patents.google.com/patent/US8945531B2/en,https://patentimages.storage.googleapis.com/48/ef/7f/e7520de2b50b00/US08945531-20150203-D00001.png
US-10071126-B2,Conditionally replicating adenovirus to express REIC gene ,"National University Corporation Okayama University, Momotaro-Gene Inc., Industry-University Cooperation Foundation Hanyang University","Hiromi Kumon, Yasutomo Nasu, Masami Watanabe, Chae Ok Yun",5/28/2014,5/26/2015,9/11/2018,9/11/2018,https://patents.google.com/patent/US10071126B2/en,https://patentimages.storage.googleapis.com/80/ac/72/4da073f4e3878b/US10071126-20180911-D00001.png
US-9850500-B2,Recombinant adenoviruses capable of regulating angiogenesis ,"Chae-Ok Yun, Joo-Hang Kim, Jin Soo Kim, Hyun Chul Shin, Yoon A Kang","Chae-Ok Yun, Joo-Hang Kim, Jin Soo Kim, Hyun Chul Shin, Yoon A Kang",1/27/2006,5/30/2006,12/26/2017,12/26/2017,https://patents.google.com/patent/US9850500B2/en,https://patentimages.storage.googleapis.com/74/fc/05/50a0f6e2e32cd5/US09850500-20171226-D00001.png
US-8568709-B2,Thymidylate kinase fusions and uses thereof ,University Health Network,"Jeffrey A. Medin, Sean Devine",3/20/2008,3/20/2009,10/29/2013,10/29/2013,https://patents.google.com/patent/US8568709B2/en,https://patentimages.storage.googleapis.com/84/f0/f2/80db081f0b940c/US08568709-20131029-D00001.png
US-8334298-B2,Treatment or prevention of ovarian hyperstimulation syndrome (OHSS) using a dopamine agonist ,Ferring International Center S.A.,"Antonio Pellicer-Martinez, Joan-Carles Arce, Carlos Simon-Valles, Raul Gomez-Gallego",4/29/2005,4/24/2006,12/18/2012,12/18/2012,https://patents.google.com/patent/US8334298B2/en,https://patentimages.storage.googleapis.com/0e/c6/8c/1683d9a2433a69/US08334298-20121218-D00001.png
US-9969998-B2,"Compositions of adenosine deaminase-2 (ADA2), variants thereof and methods of using same ","Halozyme, Inc.","Christopher D. Thanos, Lin Wang, H. Michael Shepard",10/14/2014,4/8/2016,5/15/2018,5/15/2018,https://patents.google.com/patent/US9969998B2/en,https://patentimages.storage.googleapis.com/26/8f/77/dad62e5d767001/US09969998-20180515-D00001.png
US-9795604-B2,Methods of treating and preventing graft versus host disease ,Pharmacyclics Llc,"John C. Byrd, Jason A. Dubovsky, Natarajan Muthusamy, Amy Jo Johnson, David Miklos",10/25/2013,10/24/2014,10/24/2017,10/24/2017,https://patents.google.com/patent/US9795604B2/en,https://patentimages.storage.googleapis.com/c3/3f/7b/ab92e699012667/US09795604-20171024-D00001.png
US-7329422-B2,Pharmaceutical compositions ,Kam Man Hui,Kam Man Hui,6/12/2002,6/12/2003,2/12/2008,2/12/2008,https://patents.google.com/patent/US7329422B2/en,https://patentimages.storage.googleapis.com/US7329422B2/US07329422-20080212-D00001.png
US-10328147-B2,Herpes simplex virus type-1(HSV-1) vaccine strain VC2 generating an anti-EHV-1 immune response ,Board Of Supervisors Of Louisiana State University And Agricultural And Mechanical College,Konstantin G. Kousoulas,3/24/2017,3/22/2018,6/25/2019,6/25/2019,https://patents.google.com/patent/US10328147B2/en,https://patentimages.storage.googleapis.com/2d/6b/ca/9208f649ea8ebb/US10328147-20190625-D00001.png
